id,sort,hitokoto
565,Anime,我手里拿着刀，没法抱你，我放下刀，没法保护你！
1054,Anime,在弱者眼里可能是这样，不过，我的确很强。
3826,Novel,理智不是一个统计学概念。
210,Anime,我的愿望是—幸福地活着，幸福地死去。
4353,Myself,来去无常，得过且过
4312,Other,科学就是去确定未知的事物
1388,Anime,倘若只是为了驱赶心中的寂寞，找谁都可以的。
3712,Myself,一个人有多热心，他就会感到有多寒冷
4023,Internet,善与恶逆转的瞬间，便是奇迹
4478,Internet,我只愿你们活着，为你们接风洗尘，带你们俯瞰星空，与你们共舞红尘。 我只愿你们活着。
449,Internet,喜欢大胸只是本能，喜欢贫乳才是审美。
3767,Novel,天不生我李淳罡，剑道万古长如夜。
3616,Internet,有些人坐飞机就能见到，有些人坐时光机才可以。
396,Internet,成熟不是人的心变老，是泪在打转还能微笑。
293,Game,如果我会变成恶魔，那就随他吧。我会接受放逐，一切只为了保护她。
4460,Other,如果最开始我没欺骗你，我们会怎样？
1022,Internet,父亲永远都是不善于表达他的爱，但他总是会默默地用行动告诉我们，他是有多么的爱我们。
1324,Anime,善于破坏气氛的人，不仅能破坏好的气氛，其实也能把坏的气氛破坏掉。
4306,Myself,我愿将歌化作风，聆听朗朗的春声。
4086,Other,他不是一个人在战斗！
4199,Novel,小地瓜，我找到你了。
534,Anime,“把剑放下，成为本王的妻子吧。”
3693,Anime,"我想成为一个温柔的人,因为曾被温柔的人那样对待,深深了解那种被温柔相待的感觉。"
715,Myself,枯燥的太阳因你而变的温暖，脆弱的心灵因你而变的坚强。
1312,Internet,时间是世上最快的一把杀人刀，无论你是万世将种，还是绝世美人，到头来都逃不过这把刀的索命。枯骨荒冢，有谁还记得你生前的模样是丑是美。
3598,Novel,我要这天，再遮不住我眼，要这地，再埋不了我心，要这众生，都明白我意，要那诸佛，都烟消云散!
48,Anime,一个人吃饭，太寂寞了。
841,Internet,不论生死，好坏，对错；只要载入史册那就代表胜利——历史由胜者书写
58,Anime,仍是那么熟悉的味道，只是用墓土和骨灰作成的身体，已经不再有体温。
4472,Game,就算我们知道了彼此总有一天会分别，现在的时光，也绝不是没有意义的。
4026,Myself,误会，不是始于说出的话。而且从“言行”本身开始，就已经在发生了
586,Novel,凛冬将至
4272,Other,纵是年少风流可入画，却也自成风骨难笔拓。
3741,Novel,天要你走，我要你留
28,Anime,世界上没有一个人能代替另一个人。
690,Game,我……败……了……
714,Anime,一定要保护自己的梦想，即使牺牲一切。
4445,Internet,有幽默感的人，永远都不会默默无闻。
155,Anime,羁绊是那不可切断的深切联系。即使分离，心与心也紧紧的连在一起。
585,Novel,凡人皆有一死，凡人皆需供奉。
624,Anime,男生送的礼物要方便拿来换钱才好吧！
1219,Anime,好了 接下来就让你们见识一下程序员的本事
1102,Myself,为什么我明明什么坏事都没有做，却要被那样看待？
3924,Myself,人生四然：来是偶然，去是必然，尽其当然，顺其自然 ...
3855,Novel,为遇一人而入红尘，人去我亦去，此生不留尘。
4160,Novel,失去人性，失去很多；失去兽性，失去一切。
3600,Novel,这个天地，我来过，我奋战过，我深爱过，我不在乎结局。
4055,Other,突然觉得人生正面得不行，彻底变成大人了。
4301,Novel,一切都将逝去，唯有死神永生。
4407,Myself,我们执着于模糊的现在，迷茫于陌生的未来，却从未曾发觉，耳边那一阵灿烂的微风。
4189,Internet,无论在多不幸的状况下，只要相信自己是幸福的，就能得到幸福。
4214,Internet,我想去天涯，你却带我去海角。
3831,Internet,厚道的人 运气都不会太差
179,Anime,我在未来等你。
3626,Internet,这不是神经病，是理想
801,Other,一个人有一个故事，别让你的故事留白。
422,Internet,低头不是认输，是要看清自己的路；昂头不是骄傲，是要看清自己的天空。
394,Internet,天空本是一种风景，可是遇见你之后，它变成了一种心情。
1303,Novel,"你最可爱,我说时来不及思索,但思索过后,还是这样说"
3995,Game,英雄，愿你有一份不悔的爱情！
1107,Other,守住一方平安，尽力而为，问心无愧就好。
17,Anime,或许只需一滴露水，便能守护这绽放的花朵。
4131,Myself,别人走在拼命赚钱，而我赚不到，我感觉我和这个世界格格不入
4123,Other,好男儿胸怀像大海
3656,Game,"I solemnly swear, to devote my life and abilities, in defense of the United Nations of Earth, to defend the constitution of man, and to further the universal rights of all sentient life, from the depths of the Pacific, to the edge of the galaxy, for as lo"
962,Comic,我和你，可以做朋友吗？
620,Anime,龙儿是我的！谁都不准碰！
147,Anime,人能够在心里郁积那么多的事情，而他们又会忘记那么多的事情，真是不可思议……
242,Anime,嗯，一个人也要加油，我是坚强的孩子。
875,Other,Sunny day Wow! Song power!
3695,Internet,活着努力干，死了无遗憾！
4012,Anime,有些景色必须前进才能看到，那么只有勇往直前。
472,Other,我们一路奋战，不是为了改变世界，而是为了不让世界改变我们。
4448,Game,明天会吹拂着明天的风。
1025,Novel,希望你可以记住我，记住我这样活过，这样在你身边呆过。
670,Other,一进，一跳！
4553,Other,不要想着有一份稳定的工作，而是有让生活稳定的本事。
349,Myself,自己永远是孤单的，但你可以让其他人变得不孤单。
4390,Novel,弱小和无知从来就不是一个文明毁灭的原因，傲慢才是。
4637,Anime,别人的看法都是狗屁，你是谁只有你自己说了才算，这是爹教我的道理。
4633,Internet,自立自主总胜过俯首为奴！
3907,Novel,我见诸君多有病，料诸君见我、应如是。
3778,Internet,我的每一个动作都有你的印记
666,Internet,我只是五行缺驱动程序，别说我怠惰。
964,Novel,我是个偶尔会发疯的人啊！
4507,Other,I AK IOI
117,Anime,知道活着的痛苦处的人就能对人温柔，这和软弱是不一样的。
1130,Novel,书是好东西啊，打开时能触动心灵，合上时能触动敌人的脑袋，这样好的东西真是令人喜欢啊
1394,Anime,懂得认输是非常重要的，不尝到失败的不甘，也就不会明白跌倒后怎么爬起来，更不可能再向前迈进。
4431,Game,梦比现实更易侵蚀人的精神，刻意准备的梦是危险的。
4363,Novel,也许正义会迟到，但它永远不会缺席！
1279,Novel,只有坦然接受命运的不公，才能安然享受生命的平等。
574,Novel,弱小和无知，都不是生存的障碍，傲慢才是。
3970,Game,南天寂静亮星少，北落师门赛明灯
3987,Internet,最令人伤心的事就是你发现自己已经做不好那件你曾经很擅长的事了。
1160,Anime,正是在对未来没有任何希望的时候，一个人能坚持到什么地步，才真正体现出这个人有多坚强。
3789,Myself,"为什么要难过,一直微笑就好啦"
3668,Novel,怎样都好，只要能让他们发笑就好。
934,Game,让留下的人，笑着活下去
137,Anime,只要微笑就可以了。
16,Anime,我没有梦想，但是我能保护！
4516,Myself,落座无言行三载，持笔无悔笑苍生！
273,Anime,Time waits for no one.
659,Anime,我，将某个人，唯一的某个人，试图锁定。我，
3895,Novel,傲骨几锉尽 惟立仇心 十方雷霆乍起 振紫衣
1245,Game,"电脑高手,哈哈哈哈哈,你这嘴里蹦的都是几几年的形容词啊"
694,Game,"颤抖吧,凡人！"
3641,Anime,人生没有彩排，只有现场直播，所以做最好的自己。
4368,Other,如果你给别人讲解程序时，看到对方点头了，那你就拍他一下，他肯定睡觉了。
3848,Novel,前尘种种，似烟似幻，惟有此人教我深感不负大好春光。
588,Novel,“斩尽杀绝，这是对一个文明最高的重视。”
413,Internet,既然认准这条路，何必去打听要走多久。
4440,Novel,如果一朵花很美，那么有时我会不由自主地想到：“要活下去！”
1199,Anime,只要是正义的一方，无论手段多么卑鄙都可以被原谅
462,Internet,只要一息尚存，就还有希望。
7,Anime,恋ではなく、爱でもなく、もっとずっと 深く重い。
3936,Myself,我追着你，因为我爱你
631,Game,能够实现愿望的樱花树啊，为什么不能满足这些孩子们如此真诚的要求呢？
4602,Novel,追求得到之日即其终止之日，寻觅的过程亦即失去的过程。
776,Other,"斜晖脉脉水悠悠,肠断白频洲."
681,Game,关门，放狗！
501,Other,知人者智，自知者明。
1260,Other,工业革命的火种燃起的那一刻，半个天空的星辰都熄灭了。
959,Novel,大人是不会作梦的。大人呀，是会实现梦想的。
4255,Other,轻关易道，通商宽农。
1363,Myself,不需要逃避，也不必看轻自己，接受自己的不完美，更加努力，凡是打不倒你的都会让你变得更加坚强。
418,Internet,想你想到手都断了…
4533,Myself,忘了我吧，我都忘了
1367,Other,Dream big and dare to fail.勇敢追梦、无惧失败。
1383,Novel,宇宙很大，生活更大也许以后有缘再相见
3951,Myself,你特殊的遭遇并不是你可以特殊的理由
4102,Anime,古往传奇多少别离，我 只是不经意 遇到了你
3721,Myself,是我不该如此，抱歉，怪我太矫情。
4583,Myself,"你不得不承认，你自以为那些跟你关系很好的人，他们都有关系比你更好的朋友，而你没有
"
844,Novel,愿人们的爱恨为你加冕
1346,Internet,"那些哭着喊着要走的人从来不会真的离开,真的要离开的人会挑一个风和日丽的下午,披一件大衣,不知不觉地消失"
4292,Novel,一切都将逝去，只有死神永生。
294,Game,无论发生什么，都请不要后悔与我的相遇……
4586,Myself,愿字起于心头 转瞬又死于心间
243,Anime,时间带着明显的恶意，缓缓在我的头顶流逝。
4059,Anime,如果我是雨的话，也能像连接那永远都不将交汇的天空和大地一样，去连接某个人的心吗。
4393,Other,花火みたいな綺麗な人になれば 良かったかな
3959,Other,梦与现实是不同的。所以才能够为了把梦变成现实而努力。
1062,Anime,活着本身就是一种价值，因为还有明天。
4072,Other,相逢开口笑，过后不思量。
3822,Myself,该来的回忆总令人回味。不该来的，迟早逝去。
3949,Anime,神啊 我的人生到底为何而存在呢
230,Anime,人们只是用好人来称呼对自己有用的人而以，不存在对所有人都有用的人。
3813,Internet,"模拟只会猜题意,贪心只能过样例。数学上来先打表,DP一般看规律。组合数学靠运气,计算几何瞎暴力。图论一顿套模板,数论只会GCD。"
4298,Myself,破解版的“爱情”APP，有吗？
3714,Other,别紧张，我又不是什么好人。
264,Anime,败者死于绝望，胜者死于渴望。
496,Other,己所不欲，勿施于人。
3607,Internet,他能给的，你付不起！
707,Internet,值得获取的东西，就在风险的彼岸。
1095,Anime,如果你一个人把什么都做完了，那我做什么？
817,Other,不要跟过去的自己比，要期待未来的自己，珍爱现在的自己。
111,Anime,悲伤教会了我喜悦。
4037,Myself,只要我喝的够多，寂寞就侵蚀不了我
727,Anime,润滑油是用来防止磨损的东西。在心中有着润滑油也会活得更加轻松吧。
750,Anime,不逆 不耻 不憾
4400,Myself,前进路上的阴影，来自身后的光明。
936,Myself,你的电脑，我的权限；你的命运，由我做主。
997,Anime,好梦向来易醒。
4054,Internet,为什么你宁愿吃生活上的苦 而不愿意吃学习上的苦？
1376,Novel,无论发生什么事情，哪怕是一个人成了一个没有了灵魂的躯体，那另一个人也还是要努力地工作下去。
3957,Internet,谁能让我开心，我就喜欢谁
3664,Game,身为蝼蚁的你，真的很努力呢。
4168,Anime,人生没有那么多的捷径，你不知道路的尽头是什么，但你必须向前走。
1188,Myself,宣纸泛黄，时间流逝，即使眨眼即过，也要抓住那瞬间的辉煌。
4552,Internet,大多数人高估了他们一天能做的事，但低估了他们一年能做的事。
3758,Internet,人生最好的三种状态：不期而遇、不言而喻、不药而愈——乃一俗人
1215,Myself,"错过了就错过了,再追回来天色也不对。"
37,Anime,无法飞翔的翅膀也是有意义的，因为它是曾经翱翔于天空所留下的珍贵回忆。
488,Anime,淅淅沥沥的雨，即便能填满路上的水坑，也填不满心中的空洞。
3896,Novel,清风策萍影 远夜如移 纵入冥泥 明镜仍为寄
3934,Internet,童话只美在真实却从不续写。
4380,Anime,每一个兔子都有一个大国梦
4169,Anime,一个人决定寂寞，和另一个人相互依偎又有什么错
341,Myself,只有破碎的心才有伤人的棱角。
830,Myself,每一个人都应该明确自己的方向和位置。
4355,Internet,梦终于醒了啊，期盼他日我们再萍水相逢吧。
348,Myself,宅，是一种生活状态；死宅，是一种人生境界……
4468,Anime,喜欢上一个人就是变得束手无策。
785,Myself,相互间的抚慰根本没必要只要你还存在着就足够
1382,Internet,承诺常常很像蝴蝶，美丽的盘旋后就不见了。
1392,Anime,比希望更炙热，比绝望更深邃，这就是爱啊。
892,Other,如果我们就这样死在山里面 他们会不会说我们是殉情
239,Anime,窃人者，自失其宝。
3630,Novel,"After all,tomorrow is another day!"
1159,Internet,人的欲望永无止境，就像我一开始，也只是想知道你的名字。
741,Anime,命运的红线一旦断了，就再也不会接上。
129,Anime,一天吐槽太多次的话，梗也是会用完的。
112,Anime,我到底要以怎么样的速度生活才能与你再次相遇？
1233,Novel,目的虽有，却无路可循；我们称之为路的，无非是踌躇。
812,Anime,将愿望倾入不愿忘却的回忆中…
603,Novel,生命从无中来，到无中去，每个人都处于“上场——谢幕”这样一个循环中。这个循环不是悲伤，不是无意义，意义就在这过程中;生命之所以有趣，就在于过程中的体验和收获。
4401,Anime,那么难受，那么痛苦，可是 世界这么美丽...让我如何能够忘记！
3953,Internet,虽然我们每个人都是宇宙中微不足道的尘埃，但可能是彼此眼中最亮的星。
3705,Internet,"我有两个苹果，有个人问我要一个，我不给，于是很多人凑过来说你不是还有一个苹果吗，怎么这么小气啊。
可是，苹果都是我的呀。"
3904,Novel,我薛洋，晓天地，晓人心，但终究不晓星尘。
149,Anime,人一生会遇到约2920万人，两个人相爱的概率是0.000049。所以你不爱我，我不怪你。
4594,Anime,死亡的尽头，没有神
742,Comic,人类总是将世界缩小在自己浅薄的知识范围之内，总是把超越自己理解能力的事物当成威胁自己立场的敌人来对待，非得排斥、驱除、抹杀不可……可是对于同种族的生物，又以肤色、出身来划分阶级贵贱，相互憎恨，相互残杀。
737,Other,就算这全世界 都将与你为敌 我也会守护你 所以你只需要在那微笑就好
3888,Myself,卑屈游戏谁是先该离场的呢？
3900,Novel,忘羡一曲远，曲终人不散。
4508,Novel,风啊，你还要吹到何时......
4230,Other,报君黄金台上意，提携玉龙为君死。
799,Anime,叶え！私たちの夢ー。
4075,Other,"眼见他起高楼,眼见他宴宾客,眼见他楼塌了!"
599,Novel,生命的本质就是在关系中寻找自己，并成为真正的自己;在关系中寻找爱，并成为爱。
389,Internet,以前高中时，羡慕大学考试只要及格就行；现在大学了，怀念高中考试及不及格都行……
270,Anime,算了，和你说话感觉就像是大姨妈来了。
495,Other,工欲善其事，必先利其器。
651,Anime,描线一笔接一笔，白色的素描本上渐渐萌生黑意。即便如此，还无法照准记忆中的风景。
3697,Anime,我喜欢的人…也能喜欢上自己，我认为这就是奇迹。
1005,Anime,舞台上演员不能无视剧本随便演，华丽地退场才是完成使命。
986,Myself,人心是件奇妙的东西，大部分的时候，总是愉快而又平静的生活着。
314,Novel,会长和往常一样挺着小小的胸部一副自以为了不起的样子套用某本书的内容说道……
660,Anime,散落至四方。又或是升起至四方。在无法确认这一事实的浮游感中，彗星耀辉在夜空。彗星裂开，碎片落下。
3803,Internet,impossible的完整形式是i'm possible
4603,Myself,愿将来的你，路无险阻，前途有光，每一个明天都熠熠生辉，充满希望。
938,Anime,超频链接
536,Anime,即使你忘记了我，我也不会遗忘你。
874,Anime,是你赢了...哲...
3871,Anime,卧龙低伏，入我阵来。
4245,Novel,把海弄干的鱼在海干前上了陆地，从一片黑暗森林奔向另一片黑暗森林。
167,Anime,不相信自己的人，连努力的价值都没有。
1156,Myself,不管明天会发生什么，请牢记住今天。
3747,Anime,如果，樱花掉落的速度是每秒5厘米，那么两颗心需要多久才能靠近？
4129,Anime,世界上所有的不利情况都是因为当事者的能力不足造成的
836,Anime,如果幸福有形状，该是什么样的呢？它就像玻璃，因为平时察觉不到它的存在，而它却时时在我们身边，最有力的证据就是，只要换一个角度，它就会折射出耀眼的光芒，比谁都过分强调自我的存在。
259,Internet,用番茄Lu过…比香蕉好←那是你没领悟到香蕉的正确用法
4389,Novel,师哥，玫瑰到了花期，我很想你。
4381,Myself,又苦又甜，也挺好嘛，很像生活
500,Other,信言不美，美言不信。
435,Internet,二次元什么的我本来是不感冒的，直到我的膝盖中了一箭。
86,Anime,如果我拥有如同小狗一样的尾巴的话，肯定会高兴得遮掩不住地摇来摇去吧。
4031,Novel,"仿佛这一瞬间，火光也照亮了他同驹子共同度过的岁月。这当中也充满一种说不出的苦痛和悲哀。
"
995,Anime,即使作为代价要夺走我什么，即使接下来等待我的是什么，即使那样，我无论如何都不想失去他。
862,Game,我就这样从《圣经》偷出些断章残句，来掩饰我的赤裸裸的罪行。外表上装做圣徒，暗地里是八卦心肠。
193,Anime,就算是自私……我也希望那些人能够永远都有笑容……
378,Myself,哼！悔改吧，你们这群死宅，人家可是身价四千万的大小姐。
4446,Novel,已识乾坤大，犹怜草木青。
683,Game,正在上课！
4233,Myself,即使这一切如此虚假，那又如何？
1021,Other,有一天我变老了，不知道你会不会像现在这么照顾我。
4106,Anime,我今天就要带她走，我看谁敢拦我！
4117,Game,My honor left a long time ago. 吾之荣耀，离别已久。
292,Game,这是眼泪吗？原来眼泪是这么的温暖，我一直以为，哀伤的东西都是冰冷的。
3925,Game,我为打破你周遭的囚墙而来，览尽世界，为你沉沦。
4099,Comic,不要太小看人类了！
4541,Internet,爱永远不是在乎，而是正确的表达。
4634,Anime,用决斗......给大家......带来笑容......
4396,Game,纵使疾风起，皇族不言弃。
3765,Novel,我很累，想停下了。就让我停下吧。
3979,Game,我于杀戮之中盛放，亦如黎明中的花朵。
372,Myself,在回忆里留下微笑是为了不让你哭泣...
3588,Myself,我卸掉眼鏡，世界全是朦朧美！
409,Internet,你制定的计划是.txt还是.exe?
4423,Other,人生若只如初见，何事秋风悲画扇。
571,Novel,死亡过于绝对，而活着，则有无限的可能。
300,Game,人总是会变的，不要害怕改变哦。
860,Myself,有一些情感，没办法辜负它。
3609,Other,菩提本无树，明镜亦非台，本来无一物，何处惹尘埃。
3943,Myself,小时候，我妈说我的手指长，将来能当钢琴家，然后我成了码农
4194,Myself,梦，随时生，随实灭。
1039,Internet,不管对什么事情都不能有先入为主的观念。
81,Anime,选择道路的时候怎么犹豫都没有关系，但决定之后就一定要坚持到底！
1401,Other,与众不同的生活方式很累人呢，因为找不到借口。
763,Anime,我不渴望什么在别的城市迎来的春天，只要和你在一起的春天就好，只要和你在一起就好…
3649,Game,时螶以爱吻我，我当回报以歌。
3916,Novel,只羡忘羡不羡仙，说是天天就天天
671,Other,夏天！泳装！并且……欢跃而起！！
888,Anime,笑是对身边的事物感到一瞬间的幸福而表现出来的东西。
4150,Novel,即使被关在果壳之中，我仍自以为是无限宇宙之王。
1106,Internet,我房间里堆满了情人节礼物， 我不是高富帅， 我只是个懒惰的快递员。
4143,Myself,守口如瓶，包括对自己。这是一种美德。
1035,Comic,那天，我听到了种子破土的声音，又细微又坚定。
789,Anime,我觉得只要这样继续加油，总有一天能赶上他们的。
321,Novel,用我一生，换你十年天真无邪。
530,Game,"绚烂如繁樱，瞬息绽放后凋落。 花以香为证，曾美至惊心动魄。
"
4341,Anime,用我那牵强的微笑，活出无人能比的骄傲。
4125,Anime,追寻只是因为无法抓获，想要触碰，只是因为知道自己触碰不到。
429,Internet,我的小伙伴们都惊呆了！
606,Anime,谢谢你至今为止都容忍我的任性，我是你的妹妹真的太好了。
4576,Other,欲戴王冠，必承其重。
4556,Myself,只要你在我们心里，你就不会死。
3585,Other,我永远在这里，涌着爱面朝沧海
4469,Anime,所谓人，无论是谁到了最后，都会形单影只。
4206,Other,参差荇菜，左右芼之。窈窕淑女，钟鼓乐之。
1308,Internet,"要想飞得高,就该把地平线忘掉"
3736,Anime,“不管你我相距多远，我都想告诉你 我对你的心意不会变，给即将去到陌生城市的你 ，我永远喜欢你”
3817,Other,远远地看，它就像一根孤独的琴弦紧绷在原野上，任凭风雨和岁月的弹拨。
4480,Novel,所有坚硬冰冷的东西都会永远坚硬冰冷下去，而所有柔软温暖的东西只有眼下才会柔软温暖。
4522,Anime,等着我，有马，不对，别回头，向前进，你要一直向前，我一定会追上来的。
1223,Anime,我只希望，我喜欢的人可以健康的活着。
3590,Myself,一个悲伤的故事，第二支冰激凌半价
4284,Myself,在地球75亿人内与你相遇是多么幸福啊。
452,Internet,胸部的大小并没有关系，重要的是存在于那里的温暖。
935,Comic,其实美丽的故事都是没有结局的，只因为它没有结局所以才会美丽。
77,Anime,下一次重逢，将是何年何月？天空必将见证。
4068,Myself,重逢大都是暖心的，时隔多年，偌大的城市，人海茫茫，我已不复当初，你却仍然，温暖如故
200,Anime,爱迪生说过：“要把BOSS打倒就要准备足够的等级。”
1127,Game,El psy congroo!
3610,Other,身是菩提树，心如明镜台，时时勤拂拭，勿使惹尘埃。
4302,Other,征服可能会受挫，但好奇从未停息。
726,Anime,男人至死都是少年
3881,Internet,世界上最美丽的就是世界本身
281,Comic,你为了你的正义，我为了我的正义。
4122,Myself,The more you learn the less you will feel you know.
150,Anime,我的内心就和厕纸一样单纯！
1092,Internet,梦想不会逃跑，会逃跑的只有人
119,Anime,如果你执意追寻着我的幻影，总有一天会被真正的我打败。
4274,Other,"forget-me-not，Ash to ash, dust to dust，どうか忘れないで"
3644,Other,只要有人追忆，往事就不必如烟。
4525,Novel,愿我有生之年，得见您君临天下。
3752,Anime,幸福的回忆，美满的回忆不一定会成为救赎，有时候，回忆越是美满便越痛苦，也有时候，会越害怕，无论是对于将要离开的人来说，还是对于被留下的人来说，都不可能会成为一种救赎。
4027,Myself,你不会独属于我，但我心中有你的专属位置。
3962,Comic,我命令你，喜欢我！
4116,Game,Death is like the wind; always by my side. 死亡如风，常伴吾身。
1138,Internet,输了你，赢了这个世界也没意义
38,Anime,勇气，就是即便害怕也会去做。
973,Internet,就算路不坦荡也要做自己的太阳。
3866,Anime,龙儿是我的，谁都不许碰。
161,Anime,一天最大任务莫过于，好好睡觉，好好醒来。
134,Anime,就算鼻血流尽，也不能放弃妄想。
1195,Internet,一瓶250ml的吊水，一共是3111滴。
602,Anime,迎接我们的也许是漆黑一片的夜路，即便如此，也要相信自己，勇往直前。 星空会为我们在这条道路上点缀出淡淡星光。
3636,Anime,连我爸都没打过我
1301,Other,你说一声，我也默认，我们在这月光下十指生根。
